{
  "schema_version": "0.1.0",
  "card_id": "card-kitchen-0001",
  "mode": "idea",
  "status": "draft",
  "discipline": "architecture",
  "drawing_type": "plan",
  "scale": 50,
  "units": "mm",
  "jurisdiction": "GB-ENG",
  "jurisdiction_inferred": true,
  "profile_stack": [
    { "id": "gb-eng-residential", "name": "GB-ENG Residential", "version": "1.3.0", "layer": "jurisdiction", "tier": 1, "signer": { "name": "J. Smith", "credential": "CIAT 12345", "jurisdiction": "England", "verification_level": "verified" } },
    { "id": "generic", "name": "Generic", "version": "0.9.0", "layer": "generic", "tier": null, "signer": null }
  ],
  "inputs": [
    { "kind": "text", "text": "extend my kitchen 3 m into the garden, bifold doors" },
    { "kind": "photo", "asset_id": "ast-kitchen-photo", "origin": "own_work", "rights_confirmed": true }
  ],
  "recognised": [
    { "key": "extension_depth", "label": "Extension depth", "plain_label": "How far into the garden", "value": 3000, "unit": "mm", "source": "user", "confidence": 1, "verify": false },
    { "key": "rear_doors", "object_id": "bifold", "label": "Rear doors", "plain_label": "Doors to the garden", "value": "Bifold doors", "material_id": "alu_bifold", "source": "user", "confidence": 1, "verify": false }
  ],
  "missing": [],
  "blocked": [],
  "assumptions": [
    { "id": "as-location", "key": "jurisdiction", "text": "I assumed the house is in England", "technical_term": "Jurisdiction profile GB-ENG Residential", "value": "GB-ENG", "source": "ai_inferred", "confidence": 0.7, "verify": true, "editable": true, "source_detail": { "model": { "provider": "anthropic", "model_id": "claude-sonnet-5", "task": "idea" } } },
    { "id": "as-ceiling", "key": "ceiling_height", "text": "I assumed a 2.4 m ceiling", "technical_term": "Floor-to-ceiling height", "value": 2.4, "unit": "m", "source": "ai_inferred", "confidence": 0.6, "verify": true, "editable": true, "source_detail": { "model": { "provider": "anthropic", "model_id": "claude-sonnet-5", "task": "idea" } } },
    { "id": "as-width", "key": "extension_width", "text": "I assumed the extension is 3.2 m wide", "value": 3.2, "unit": "m", "source": "ai_inferred", "confidence": 0.6, "verify": true, "editable": true, "source_detail": { "reference": { "asset_id": "ast-kitchen-photo", "origin": "own_work", "rights_confirmed": true }, "note": "Estimated from the photo." } },
    { "id": "as-walls", "key": "wall_build_up", "text": "I assumed brick walls with a cavity and a block inner wall — the usual construction in England", "technical_term": "Brick / cavity / block", "value": "gb_cavity_brick_block", "source": "profile", "confidence": 1, "verify": false, "editable": true, "source_detail": { "profile": { "id": "gb-eng-residential", "version": "1.3.0" } } },
    { "id": "as-roof", "key": "roof_type", "text": "I assumed a pitched roof with tiles", "technical_term": "Timber trussed pitched roof, tiled", "value": "gb_pitched_tiled", "source": "profile", "confidence": 1, "verify": false, "editable": true, "source_detail": { "profile": { "id": "gb-eng-residential", "version": "1.3.0" } } }
  ],
  "created_at": "2026-09-15T09:30:08Z"
}
