{
  "schema_version": "0.1.0",
  "card_id": "card-parapet-0001",
  "mode": "draft",
  "status": "confirmed",
  "confirmed_by": "usr-technologist-01",
  "confirmed_at": "2026-09-14T13:54:40Z",
  "discipline": "architecture",
  "drawing_type": "detail",
  "detail_type": "parapet",
  "scale": 10,
  "units": "mm",
  "jurisdiction": "GB-ENG",
  "jurisdiction_inferred": false,
  "profile_stack": [
    { "id": "gb-eng-residential", "name": "GB-ENG Residential", "version": "1.3.0", "layer": "jurisdiction", "tier": 1, "signer": { "name": "J. Smith", "credential": "CIAT 12345", "jurisdiction": "England", "verification_level": "verified" } },
    { "id": "generic", "name": "Generic", "version": "0.9.0", "layer": "generic", "tier": null, "signer": null }
  ],
  "inputs": [
    { "kind": "text", "text": "Parapet detail at the warm flat roof. Brick outer leaf, 100 block inner, 600 parapet above the membrane, two-layer bitumen membrane, aluminium coping RAL 7016 falling to the roof." },
    { "kind": "pdf", "asset_id": "ast-ref-section-a", "origin": "own_work", "rights_confirmed": true }
  ],
  "recognised": [
    { "key": "wall_build_up", "object_id": "wall_outer", "label": "Wall build-up", "value": "102.5 brick / 50 cavity / 120 PIR / 100 block", "source": "user", "confidence": 1, "verify": false },
    { "key": "insulation_type", "object_id": "ins_01", "label": "Cavity insulation", "value": "PIR 120", "unit": "mm", "material_id": "pir_board", "source": "ai_inferred", "confidence": 0.78, "verify": true, "source_detail": { "reference": { "asset_id": "ast-ref-section-a", "origin": "own_work", "rights_confirmed": true, "page": 1 }, "note": "Read from the reference section; thickness not dimensioned." } },
    { "key": "parapet_height", "label": "Parapet height above membrane", "value": 600, "unit": "mm", "source": "user", "confidence": 1, "verify": false },
    { "key": "membrane_system", "object_id": "roof_membrane", "label": "Membrane system", "value": "Reinforced bitumen membrane, two-layer", "material_id": "bitumen_membrane", "source": "user", "confidence": 1, "verify": false },
    { "key": "coping_material", "object_id": "coping", "label": "Coping material", "value": "Aluminium, RAL 7016", "material_id": "alu_coping", "source": "user", "confidence": 1, "verify": false },
    { "key": "fall_direction", "object_id": "coping", "label": "Coping fall", "value": "to roof", "source": "user", "confidence": 1, "verify": false }
  ],
  "missing": [],
  "blocked": [],
  "assumptions": [],
  "created_at": "2026-09-14T13:53:12Z"
}
