{
  "schema_version": "0.1.0",
  "card_id": "card-verge",
  "mode": "draft",
  "status": "confirmed",
  "confirmed_by": "fixture-user",
  "confirmed_at": "2026-09-27T00:00:00Z",
  "discipline": "architecture",
  "drawing_type": "detail",
  "detail_type": "verge",
  "scale": 10,
  "units": "mm",
  "jurisdiction": "GB-ENG",
  "profile_stack": [
    {
      "id": "gb-eng-residential",
      "name": "GB-ENG Residential",
      "version": "0.1.0",
      "layer": "jurisdiction",
      "tier": 1,
      "signer": null
    },
    {
      "id": "generic",
      "name": "Generic",
      "version": "0.1.0",
      "layer": "generic",
      "tier": null,
      "signer": null
    }
  ],
  "inputs": [
    {
      "kind": "text",
      "text": "Draw the supplied schematic verge using only the supplied component dimensions."
    }
  ],
  "recognised": [
    {
      "key": "wall.thickness",
      "object_id": "wall",
      "label": "wall",
      "value": 102.5,
      "unit": "mm",
      "source": "user",
      "confidence": 1,
      "verify": false
    },
    {
      "key": "roof.thickness",
      "object_id": "roof",
      "label": "roof",
      "value": 25,
      "unit": "mm",
      "source": "user",
      "confidence": 1,
      "verify": false
    },
    {
      "key": "underlay.thickness",
      "object_id": "underlay",
      "label": "underlay",
      "value": 2,
      "unit": "mm",
      "source": "user",
      "confidence": 1,
      "verify": false
    },
    {
      "key": "edge.thickness",
      "object_id": "edge",
      "label": "edge",
      "value": 20,
      "unit": "mm",
      "source": "user",
      "confidence": 1,
      "verify": false
    }
  ],
  "missing": [],
  "blocked": [],
  "assumptions": [],
  "created_at": "2026-09-27T00:00:00Z"
}
