{
  "schema_version": "0.1.0",
  "card_id": "card-window_sill",
  "mode": "draft",
  "status": "confirmed",
  "confirmed_by": "fixture-user",
  "confirmed_at": "2026-09-27T00:00:00Z",
  "discipline": "architecture",
  "drawing_type": "detail",
  "detail_type": "window_sill",
  "scale": 10,
  "units": "mm",
  "jurisdiction": "GB-ENG",
  "profile_stack": [
    {
      "id": "gb-eng-residential",
      "name": "GB-ENG Residential",
      "version": "0.1.0",
      "layer": "jurisdiction",
      "tier": 1,
      "signer": null
    },
    {
      "id": "generic",
      "name": "Generic",
      "version": "0.1.0",
      "layer": "generic",
      "tier": null,
      "signer": null
    }
  ],
  "inputs": [
    {
      "kind": "text",
      "text": "Draw the supplied schematic window_sill using only the supplied component dimensions."
    }
  ],
  "recognised": [
    {
      "key": "wall.thickness",
      "object_id": "wall",
      "label": "wall",
      "value": 102.5,
      "unit": "mm",
      "source": "user",
      "confidence": 1,
      "verify": false
    },
    {
      "key": "sill.thickness",
      "object_id": "sill",
      "label": "sill",
      "value": 50,
      "unit": "mm",
      "source": "user",
      "confidence": 1,
      "verify": false
    },
    {
      "key": "tray.thickness",
      "object_id": "tray",
      "label": "tray",
      "value": 2,
      "unit": "mm",
      "source": "user",
      "confidence": 1,
      "verify": false
    },
    {
      "key": "frame.thickness",
      "object_id": "frame",
      "label": "frame",
      "value": 70,
      "unit": "mm",
      "source": "user",
      "confidence": 1,
      "verify": false
    }
  ],
  "missing": [],
  "blocked": [],
  "assumptions": [],
  "created_at": "2026-09-27T00:00:00Z"
}
